
--| Initial Request made by client to look up IPv4 of yahoo.com
07:51:53.020278 IP ip-172-31-85-150.ec2.internal.56207 > 172.31.95.123.domain: 60454+ A? www.yahoo.com. (31)

--| Request made by client to look up IPv6 of yahoo.com
07:51:53.020291 IP ip-172-31-85-150.ec2.internal.56207 > 172.31.95.123.domain: 21823+ AAAA? www.yahoo.com. (31)

--| Reponse of IPv4 of yahoo.com from local caching resolver 
07:51:53.368135 IP 172.31.95.123.domain > ip-172-31-85-150.ec2.internal.56207: 60454 5/4/2 CNAME atsv2-fp-shed.wg1.b.yahoo.com., A 98.138.219.231, A 98.138.219.232, A 72.30.35.9, A 72.30.35.10 (247)

--| Reponse of IPv6 of yahoo.com from local caching resolver 
07:51:53.368241 IP 172.31.95.123.domain > ip-172-31-85-150.ec2.internal.56207: 21823 5/4/2 CNAME atsv2-fp-shed.wg1.b.yahoo.com., AAAA 2001:4998:58:1836::10, AAAA 2001:4998:58:1836::11, AAAA 2001:4998:44:41d::4, AAAA 2001:4998:44:41d::3 (295)

